{
  "organization_id": "00000000-0000-0000-0000-000000000001",
  "smart_code": "HERA.SALON.POS.SALE.INVOICE.v1",
  "transaction_type": "sale",
  "transaction_date": "2025-09-24T10:00:00Z",
  "source_entity_id": "11111111-1111-1111-1111-111111111111",
  "business_context": {
    "channel": "POS",
    "vat_scheme": "UK-STD"
  },
  "lines": [
    {
      "line_type": "service",
      "entity_id": "22222222-2222-2222-2222-222222222222",
      "quantity": 1,
      "unit_amount": 60
    },
    {
      "line_type": "tax",
      "description": "VAT 20%",
      "line_amount": 12
    }
  ]
}